paper_id,claim,figure_id,title,caption,local_image_path,url
PMC9745563,"Participants viewed
stimuli approximately 100 cm from the monitor, subtending a visual angle of
3.5°, and completed a baseline resting task, the doors task before and
after stress induction, and finally a post-stressor resting task (see Figure 1).",PMC9745563_figure_1,Figure 1.,"Procedural figure demonstrating laboratory task flow. Reward ERP
measurement was taken during the pre- and post-stress doors task, while
subjective negative affect (NA) measurement was taken during the MMST.",./data/PMC9745563/images/figure_1.jpg,https://cdn.ncbi.nlm.nih.gov/pmc/blobs/ab00/9745563/535c0967086c/nihms-1808767-f0001.jpg
PMC9745563,"See Figure 2 and 3 for waveforms representing responses to reward and punishment for
both reinforcement conditions at pre- and post-stressor, as well as
topographical difference maps.",PMC9745563_figure_2,Figure 2.,"Stimulus-locked PCA-derived TF3SF3 factors (upper) and raw waveforms
(lower) at FCz for pre-stress (left) and post-stress (right) during the win-lose
money condition of the Doors Task. Topographical maps for TF3SF3 waveforms show
the factor amplitudes at each electrode at the peak time point (300ms).
Topographical maps for raw waveforms show average scalp activity between 200 and
348 ms with color bar scale in microvolts.",./data/PMC9745563/images/figure_2.jpg,https://cdn.ncbi.nlm.nih.gov/pmc/blobs/ab00/9745563/457f811462fe/nihms-1808767-f0002.jpg
PMC9745563,"Topographical maps for raw waveforms show average scalp activity between 200 and
348 ms with color bar scale in microvolts.Figure 3.",PMC9745563_figure_3,Figure 3.,"Stimulus-locked PCA-derived TF3SF3 factors (upper) and raw waveforms
(lower) at FCz for pre-stress (left) and post-stress (right) during the
safety-noise condition of the Doors Task. Topographical maps for TF3SF3
waveforms show the factor amplitudes at each electrode at the peak time point
(296ms). Topographical maps for raw waveforms show average scalp activity
between 200 and 348 ms, with color bar scale in microvolts.",./data/PMC9745563/images/figure_3.jpg,https://cdn.ncbi.nlm.nih.gov/pmc/blobs/ab00/9745563/3347e423faca/nihms-1808767-f0003.jpg
PMC9745563,"In both negative and positive reinforcement PCAs, a frontal-central
positivity (TF3SF3) functionally (reward > punishment) and topographical
(maximal at frontal-central sites) and temporal (i.e., peaked ~300ms)
characteristics consistent with the RewP component emerged (see Figure 2 for factor waveforms).",PMC9745563_figure_2,Figure 2.,"Stimulus-locked PCA-derived TF3SF3 factors (upper) and raw waveforms
(lower) at FCz for pre-stress (left) and post-stress (right) during the win-lose
money condition of the Doors Task. Topographical maps for TF3SF3 waveforms show
the factor amplitudes at each electrode at the peak time point (300ms).
Topographical maps for raw waveforms show average scalp activity between 200 and
348 ms with color bar scale in microvolts.",./data/PMC9745563/images/figure_2.jpg,https://cdn.ncbi.nlm.nih.gov/pmc/blobs/ab00/9745563/457f811462fe/nihms-1808767-f0002.jpg
PMC9745563,"However, a significant
CUD*TBI*stress*condition*feedback interaction was found,
F(1,624)=4.19, p=.041.1 To examine this interaction, the
CUD*stress*condition*feedback interaction was examined in the TBI− and
TBI+ groups (see estimated marginal means in Figure 4).",PMC9745563_figure_4,Figure 4.,"ΔReward-No Reward amplitude for both positive (Panels A and C)
and negative (Panels B and D) reinforcement condition compared between pre- and
post-stress at Mild and Severe Cannabis Use Disorder (CUD) diagnosis. Panels A
and B show the Δreward-no reward amplitude at Mild and Severe CUD for
individuals with previous history of TBI (TBI+), while Panels C and D show this
interaction for individuals without TBI history (TBI−). Error bars
indicate 95% confidence intervals.",./data/PMC9745563/images/figure_4.jpg,https://cdn.ncbi.nlm.nih.gov/pmc/blobs/ab00/9745563/be7ca6d2d641/nihms-1808767-f0004.jpg
