paper_id,claim,figure_id,title,caption,local_image_path,url
PMC10354654,"According to the motivational affordances theory [27], information and communication technologies (ICTs) have motivational affordances that can be divided into several areas of motivational sources and needs, as shown in Figure 1.",PMC10354654_figure_1,Figure 1.,The motivational affordances theory.,./data/PMC10354654/images/figure_1.jpg,https://cdn.ncbi.nlm.nih.gov/pmc/blobs/6c49/10354654/4eb1f04387e9/jmir_v25i1e42260_fig1.jpg
PMC10354654,"Examples of the virtual degree are shown in Figure 2, with the statement in the bachelor’s degree translated into English.",PMC10354654_figure_2,Figure 2.,Examples of the virtual degree.,./data/PMC10354654/images/figure_2.jpg,https://cdn.ncbi.nlm.nih.gov/pmc/blobs/6c49/10354654/13d2ba4b302f/jmir_v25i1e42260_fig2.jpg
PMC10354654,"Open in a new tab
Examples of the virtual degree.Figure 3.",PMC10354654_figure_3,Figure 3.,"Home page of the “Smoking Cessation Bar.""",./data/PMC10354654/images/figure_3.jpg,https://cdn.ncbi.nlm.nih.gov/pmc/blobs/6c49/10354654/0e13227649a7/jmir_v25i1e42260_fig3.jpg
PMC10354654,"Open in a new tab
Home page of the “Smoking Cessation Bar.""Figure 4.",PMC10354654_figure_4,Figure 4.,An example of applying for and awarding a bachelor’s degree certificate.,./data/PMC10354654/images/figure_4.jpg,https://cdn.ncbi.nlm.nih.gov/pmc/blobs/6c49/10354654/263874fe5dab/jmir_v25i1e42260_fig4.jpg
