paper_id,claim,figure_id,title,caption,local_image_path,url
PMC9763787,Figure 1 presents the research procedure used in this study.,PMC9763787_figure_1,Fig. 1.,Research procedure,./data/PMC9763787/images/figure_1.jpg,https://cdn.ncbi.nlm.nih.gov/pmc/blobs/f14b/9763787/b29289c5614f/11628_2022_516_Fig1_HTML.jpg
PMC9763787,"Step 1: procedure for extracting related words
Figure 2 shows the results of the word cloud analysis of keywords after extracting all the related words.",PMC9763787_figure_2,Fig. 2.,Word cloud analysis of keywords,./data/PMC9763787/images/figure_2.jpg,https://cdn.ncbi.nlm.nih.gov/pmc/blobs/f14b/9763787/a9fe2e2adb1f/11628_2022_516_Fig2_HTML.jpg
PMC9763787,"The results of the word cloud analysis, shown in Fig. 2, revealed only a small number of keywords due to the diverse service fields.",PMC9763787_figure_2,Fig. 2.,Word cloud analysis of keywords,./data/PMC9763787/images/figure_2.jpg,https://cdn.ncbi.nlm.nih.gov/pmc/blobs/f14b/9763787/a9fe2e2adb1f/11628_2022_516_Fig2_HTML.jpg
PMC9763787,Figure 2 shows the results of the word cloud analysis of keywords after extracting all the related words.,PMC9763787_figure_2,Fig. 2.,Word cloud analysis of keywords,./data/PMC9763787/images/figure_2.jpg,https://cdn.ncbi.nlm.nih.gov/pmc/blobs/f14b/9763787/a9fe2e2adb1f/11628_2022_516_Fig2_HTML.jpg
