paper_id,claim,figure_id,title,caption,local_image_path,url
PMC10064579,This process resulted in 46 articles from 42 studies that met the eligibility criteria (Figure 1).,PMC10064579_figure_1,Figure 1.,A PRISMA (Preferred Reporting Items for Systematic Review) diagram for the steps of article search and selection for the meta-analysis. CNKI = China National Knowledge Infrastructure.,./data/PMC10064579/images/figure_1.jpg,https://cdn.ncbi.nlm.nih.gov/pmc/blobs/f94c/10064579/938d40e94258/nihms-1883048-f0001.jpg
PMC10064579,"All the 95% CIs were overlapped, indicating there were not significant differences in the relationships between physical abuse and Level-1 or Level-2 behavior problems (see Figure 2 and Table 3).",PMC10064579_figure_2,Figure 2.,"Forest plot of the association of child physical abuse (PA) and externalizing (EXTER), internalizing (INTER), and mixed behavior problems (MixedBP, which refers to both externalizing and internalizing behaviors). The square shape and bar line represent the estimate of effect size and 95% confidence interval for each study, respectively. The diamond shapes represent the pooled estimates of the effect sizes for different behavioral outcomes. Favors B indicates that child maltreatment increases behavior problems, while Favors A indicates child mal-treatment decreases behavior problems.",./data/PMC10064579/images/figure_2.jpg,https://cdn.ncbi.nlm.nih.gov/pmc/blobs/f94c/10064579/f8f8aefd4b8f/nihms-1883048-f0002.jpg
PMC10064579,"Specifically, the associations of emotional abuse with Level-2 behavior problems, including depression, self-injury behavior, and somatic complaints, were higher than that of emotional abuse with aggression (p values < .05; see Figure 3 and Table 3).",PMC10064579_figure_3,Figure 3.,"Forest plot of the associations of child emotional abuse (EA) and externalizing (EXTER), internalizing (INTER), and mixed behavior problems (MixedBP, which refers to both externalizing and internalizing behaviors). The square shape and bar line represent the estimate of effect size and 95% confidence interval for each study, respectively. The diamond shapes represent the pooled estimates of the effect sizes for different behavioral outcomes. Favors B indicates that child maltreatment increases behavior problems, while Favors A indicates child mal-treatment decreases behavior problems.",./data/PMC10064579/images/figure_3.jpg,https://cdn.ncbi.nlm.nih.gov/pmc/blobs/f94c/10064579/ec8bf9111f98/nihms-1883048-f0003.jpg
PMC10064579,Neglect was also associated with all Level-2 behavior problems about equally because all 95% CI overlapped (see Figure 4 and Table 3).,PMC10064579_figure_4,Figure 4.,"Forest plot of the associations of child neglect and externalizing (EXTER) and internalizing (INTER). The square shape and bar line represent the estimate of effect size and 95% confidence interval for each study, respectively. The diamond shapes represent the pooled estimates of the effect sizes for different behavioral outcomes. Favors B indicates that child maltreatment increases behavior problems, while Favors A indicates child maltreatment decreases behavior problems.",./data/PMC10064579/images/figure_4.jpg,https://cdn.ncbi.nlm.nih.gov/pmc/blobs/f94c/10064579/f357d5c11d91/nihms-1883048-f0004.jpg
PMC10064579,"Favors B indicates that child maltreatment increases behavior problems, while Favors A indicates child maltreatment decreases behavior problems.Mixed Child Maltreatment
All studies that examined the relationship between child maltreatment without differentiating its subtypes reported increased externalizing (Hedges’s g = .713, 95% CI [0.436, 1.989]) and internalizing (Hedges’s g = .626, 95% CI [0.260,0.902]) behaviors about equally (Figure 5 and Table 3).",PMC10064579_figure_5,Figure 5.,"Forest plot of the associations of mixed child maltreatment (MIXED refers to combined multiple types of child maltreatment) and externalizing (EXTER) and internalizing (INTER). The square shape and bar line represent the estimate of effect size and 95% confidence interval for each study, respectively. The diamond shapes represent the pooled estimates of the effect sizes for different behavioral outcomes. Favors B indicates that child maltreatment increases behavior problems, while Favors A indicates child maltreatment decreases behavior problems.",./data/PMC10064579/images/figure_5.jpg,https://cdn.ncbi.nlm.nih.gov/pmc/blobs/f94c/10064579/3279ed6b4bef/nihms-1883048-f0005.jpg
PMC10064579,The funnel plots were symmetrical (Figure 6).,PMC10064579_figure_6,Figure 6.,"Funnel plots of the included studies. (A) Studies of physical abuse and externalizing behaviors, (B) studies of physical abuse and internalizing behaviors, (C) studies of emotional abuse and externalizing behaviors, (D) studies of emotional abuse and internalizing behaviors, (E) studies of neglect and externalizing behaviors, (F) studies of neglect and internalizing behaviors, and (G) all studies included in the meta-analysis. Hedges’s g was calculated from Cohen’s d multiplying J, where  to correct for potential bias introduced by studies with small sample sizes (N).",./data/PMC10064579/images/figure_6.jpg,https://cdn.ncbi.nlm.nih.gov/pmc/blobs/f94c/10064579/9e1edbdbdc06/nihms-1883048-f0006.jpg
PMC10064579,"Mixed Child Maltreatment
All studies that examined the relationship between child maltreatment without differentiating its subtypes reported increased externalizing (Hedges’s g = .713, 95% CI [0.436, 1.989]) and internalizing (Hedges’s g = .626, 95% CI [0.260,0.902]) behaviors about equally (Figure 5 and Table 3).",PMC10064579_figure_5,Figure 5.,"Forest plot of the associations of mixed child maltreatment (MIXED refers to combined multiple types of child maltreatment) and externalizing (EXTER) and internalizing (INTER). The square shape and bar line represent the estimate of effect size and 95% confidence interval for each study, respectively. The diamond shapes represent the pooled estimates of the effect sizes for different behavioral outcomes. Favors B indicates that child maltreatment increases behavior problems, while Favors A indicates child maltreatment decreases behavior problems.",./data/PMC10064579/images/figure_5.jpg,https://cdn.ncbi.nlm.nih.gov/pmc/blobs/f94c/10064579/3279ed6b4bef/nihms-1883048-f0005.jpg
PMC10064579,"All studies that examined the relationship between child maltreatment without differentiating its subtypes reported increased externalizing (Hedges’s g = .713, 95% CI [0.436, 1.989]) and internalizing (Hedges’s g = .626, 95% CI [0.260,0.902]) behaviors about equally (Figure 5 and Table 3).",PMC10064579_figure_5,Figure 5.,"Forest plot of the associations of mixed child maltreatment (MIXED refers to combined multiple types of child maltreatment) and externalizing (EXTER) and internalizing (INTER). The square shape and bar line represent the estimate of effect size and 95% confidence interval for each study, respectively. The diamond shapes represent the pooled estimates of the effect sizes for different behavioral outcomes. Favors B indicates that child maltreatment increases behavior problems, while Favors A indicates child maltreatment decreases behavior problems.",./data/PMC10064579/images/figure_5.jpg,https://cdn.ncbi.nlm.nih.gov/pmc/blobs/f94c/10064579/3279ed6b4bef/nihms-1883048-f0005.jpg
