paper_id,claim,figure_id,title,caption,local_image_path,url
PMC5554058,"This observation was supported by FTIR spectra (Figure 1), which indicated that when the Cu-lignin mixture was heated at 600 °C (Figure 1a), there were traceable oxygen-containing groups in the fingerprint region indicated by the aromatic C=O bond at 1700 cm−1 and the C–O–C bond at 1050 cm−1 [20]; however, weaker peak intensities of oxygen-containing groups were detected for pure BCL-DI lignin.",PMC5554058_figure_1,Figure 1.,"FTIR spectra of lignin samples with and without copper catalyst, treated at (a) 600 °C; (b) 800 °C; and (c) 1000 °C, respectively.",./data/PMC5554058/images/figure_1.jpg,https://cdn.ncbi.nlm.nih.gov/pmc/blobs/be81/5554058/b91b53af6f1a/materials-10-00677-g001a.jpg
PMC5554058,"As temperature further increased to 800 °C and 1000 °C, there was no sign of function groups detected in the fingerprint area for pure BCL-DI lignin samples (Figure 1b,c).",PMC5554058_figure_1,Figure 1.,"FTIR spectra of lignin samples with and without copper catalyst, treated at (a) 600 °C; (b) 800 °C; and (c) 1000 °C, respectively.",./data/PMC5554058/images/figure_1.jpg,https://cdn.ncbi.nlm.nih.gov/pmc/blobs/be81/5554058/b91b53af6f1a/materials-10-00677-g001a.jpg
PMC5554058,Figure 2 shows the XRD spectra of samples with two different Cu-to-lignin weight ratios treated at 1000 °C.,PMC5554058_figure_2,Figure 2.,"XRD spectra of Cu-lignin mixtures with their weight ratios of 1:4 and 1:1, respectively.",./data/PMC5554058/images/figure_2.jpg,https://cdn.ncbi.nlm.nih.gov/pmc/blobs/be81/5554058/911e2a45da98/materials-10-00677-g002.jpg
PMC5554058,"The graphite peaks around 2θ = 24° (Figure 2) were still obvious compared to the high intensity of copper peaks, indicating that the graphite crystallinity of a higher Cu-to-lignin weight ratio was higher than the one with a lower weight ratio.",PMC5554058_figure_2,Figure 2.,"XRD spectra of Cu-lignin mixtures with their weight ratios of 1:4 and 1:1, respectively.",./data/PMC5554058/images/figure_2.jpg,https://cdn.ncbi.nlm.nih.gov/pmc/blobs/be81/5554058/911e2a45da98/materials-10-00677-g002.jpg
PMC5554058,HRTEM images (Figure 3) illustrate uniformly distributed GECNs with three different Cu-to-lignin weight ratios evaluated at 1000 °C.,PMC5554058_figure_3,Figure 3.,"TEM images of Cu-lignin mixtures with weight ratios of 1:4 (a); 1:2 (b); and 1:1 (c), treated at 1000 °C.",./data/PMC5554058/images/figure_3.jpg,https://cdn.ncbi.nlm.nih.gov/pmc/blobs/be81/5554058/14995d866741/materials-10-00677-g003.jpg
PMC5554058,"Open in a new tab
TEM images of Cu-lignin mixtures with weight ratios of 1:4 (a); 1:2 (b); and 1:1 (c), treated at 1000 °C.Our previous study [20] showed that the onset of growth of the graphene layer occurred at above 300 °C, and the GECNs formed at lower temperatures (<600 °C) had less than five graphene layers shelling copper nanoparticles, but there were still functional groups observed at 600 °C (Figure 1a), which indicated the existence of defects on graphene layers [29].",PMC5554058_figure_1,Figure 1.,"FTIR spectra of lignin samples with and without copper catalyst, treated at (a) 600 °C; (b) 800 °C; and (c) 1000 °C, respectively.",./data/PMC5554058/images/figure_1.jpg,https://cdn.ncbi.nlm.nih.gov/pmc/blobs/be81/5554058/b91b53af6f1a/materials-10-00677-g001a.jpg
PMC5554058,"However, the crystallinity of graphene layers was improved with a superior layer structure (inset of Figure 3a).",PMC5554058_figure_3,Figure 3.,"TEM images of Cu-lignin mixtures with weight ratios of 1:4 (a); 1:2 (b); and 1:1 (c), treated at 1000 °C.",./data/PMC5554058/images/figure_3.jpg,https://cdn.ncbi.nlm.nih.gov/pmc/blobs/be81/5554058/14995d866741/materials-10-00677-g003.jpg
PMC5554058,"The disappearance of functional groups at 800 °C and 1000 °C (Figure 1b,c) also indicated that the structure of the graphene layers was superior because only the carbon network existed in the system, without interruptions by non-carbon atoms [29].",PMC5554058_figure_1,Figure 1.,"FTIR spectra of lignin samples with and without copper catalyst, treated at (a) 600 °C; (b) 800 °C; and (c) 1000 °C, respectively.",./data/PMC5554058/images/figure_1.jpg,https://cdn.ncbi.nlm.nih.gov/pmc/blobs/be81/5554058/b91b53af6f1a/materials-10-00677-g001a.jpg
PMC5554058,"Our previous study [20] showed that the onset of growth of the graphene layer occurred at above 300 °C, and the GECNs formed at lower temperatures (<600 °C) had less than five graphene layers shelling copper nanoparticles, but there were still functional groups observed at 600 °C (Figure 1a), which indicated the existence of defects on graphene layers [29].",PMC5554058_figure_1,Figure 1.,"FTIR spectra of lignin samples with and without copper catalyst, treated at (a) 600 °C; (b) 800 °C; and (c) 1000 °C, respectively.",./data/PMC5554058/images/figure_1.jpg,https://cdn.ncbi.nlm.nih.gov/pmc/blobs/be81/5554058/b91b53af6f1a/materials-10-00677-g001a.jpg
