paper_id,claim,figure_id,title,caption,local_image_path,url
PMC8226202,Each account has a name beginning with the “@” symbol which is also known as a ‘handle’ (Fig. 1).,PMC8226202_figure_1,Fig. (1).,Anatomy of a tweet: figure explaning the essential part of a tweet. (A higher resolution / colour version of this figure is available in the electronic copy of the article).,./data/PMC8226202/images/figure_1.jpg,https://cdn.ncbi.nlm.nih.gov/pmc/blobs/e2d1/8226202/efaf7a194580/CCR-17-150_F1.jpg
PMC8226202,"The Utility of Social Media In Cardiac Imaging (Fig. 3)
Fig. (3).",PMC8226202_figure_3,Fig. (2).,"A) Top ten influencers of commonly used cardiac imaging hashtags. B) Tweet Activity Trends of commonly used cardiac imaging hashtags. C) Global Reach of Social Media by country of users of the hashtag #Cardiotwitter and Tweet Activity Trends of commonly used cardiac imaging hashtags. An analysis of tweets, participants, and digital impressions of the most widely-used cardiology hashtags. *Registration date reflects the date the hashtag was registered with symplur.com. Individual hashtag data is from the registration date to access on August 8th 2019. †The total number of unique tweets since the hashtag was registered on symplur.com. ‡Impressions are computed by taking the number of times an account has tweeted multiplied by the account’s number of followers repeated for all accounts, then finally summed up. §The total number of times each photo, GIF, or video was shared. ^The total number of papers or links/URLs shared. Data from Symplur signals. (A higher resolution / colour version of this figure is available in the electronic copy of the article).
*Imaging symbol graphic credit: Dr.Juan Lopez Mattei.",./data/PMC8226202/images/figure_3.jpg,https://cdn.ncbi.nlm.nih.gov/pmc/blobs/e2d1/8226202/a5ad798c2d04/CCR-17-150_F2.jpg
PMC8226202,"The era of multimodality cardiac imaging has truly arrived, and this is reflected on social media through the ubiquitous use of #echofirst, #YesCCT, #whyCMR, and #CVNuc, which have collectively generated millions of digital impressions (Fig. 2).",PMC8226202_figure_2,Fig. (3).,Use of social media in cardiac imaging. (A higher resolution / colour version of this figure is available in the electronic copy of the article).,./data/PMC8226202/images/figure_2.jpg,https://cdn.ncbi.nlm.nih.gov/pmc/blobs/e2d1/8226202/152a4be48699/CCR-17-150_F3.jpg
PMC8226202,The Utility of Social Media In Cardiac Imaging (Fig. 3)5.,PMC8226202_figure_3,Fig. (2).,"A) Top ten influencers of commonly used cardiac imaging hashtags. B) Tweet Activity Trends of commonly used cardiac imaging hashtags. C) Global Reach of Social Media by country of users of the hashtag #Cardiotwitter and Tweet Activity Trends of commonly used cardiac imaging hashtags. An analysis of tweets, participants, and digital impressions of the most widely-used cardiology hashtags. *Registration date reflects the date the hashtag was registered with symplur.com. Individual hashtag data is from the registration date to access on August 8th 2019. †The total number of unique tweets since the hashtag was registered on symplur.com. ‡Impressions are computed by taking the number of times an account has tweeted multiplied by the account’s number of followers repeated for all accounts, then finally summed up. §The total number of times each photo, GIF, or video was shared. ^The total number of papers or links/URLs shared. Data from Symplur signals. (A higher resolution / colour version of this figure is available in the electronic copy of the article).
*Imaging symbol graphic credit: Dr.Juan Lopez Mattei.",./data/PMC8226202/images/figure_3.jpg,https://cdn.ncbi.nlm.nih.gov/pmc/blobs/e2d1/8226202/a5ad798c2d04/CCR-17-150_F2.jpg
