paper_id,claim,figure_id,title,caption,local_image_path,url
PMC12054909,The steps recommended by Moher et al are presented in the context of this project in Fig 1.,PMC12054909_figure_1,Fig 1. Project steps.,"Moher D, Schulz KF, Simera I, Altman DG. Guidance for developers of health research reporting guidelines. PLoS Med. 2010;7(2):e1000217. PMID: 20169112; PMCID: PMC2821895.",./data/PMC12054909/images/figure_1.jpg,https://cdn.ncbi.nlm.nih.gov/pmc/blobs/5c4e/12054909/5ab99ac8d6f7/pone.0321587.g001.jpg
PMC12054909,Step 3: Obtaining funding for the guideline initiative was eliminated from Fig 1 as no funding is associated with this project.,PMC12054909_figure_1,Fig 1. Project steps.,"Moher D, Schulz KF, Simera I, Altman DG. Guidance for developers of health research reporting guidelines. PLoS Med. 2010;7(2):e1000217. PMID: 20169112; PMCID: PMC2821895.",./data/PMC12054909/images/figure_1.jpg,https://cdn.ncbi.nlm.nih.gov/pmc/blobs/5c4e/12054909/5ab99ac8d6f7/pone.0321587.g001.jpg
PMC12054909,Fig 2 summarises the article retrieval process.,PMC12054909_figure_2,Fig 2. Prisma flow diagram.,"Haddaway, N. R., Page, M. J., Pritchard, C. C., & McGuinness, L. A. (2022). PRISMA2020: An R package and Shiny app for producing PRISMA 2020-compliant flow diagrams, with interactivity for optimised digital transparency and Open Synthesis Campbell Systematic Reviews, 18, e1230. https://doi.org/10.1002/cl2.1230Downloadcitation(.ris).",./data/PMC12054909/images/figure_2.jpg,https://cdn.ncbi.nlm.nih.gov/pmc/blobs/5c4e/12054909/ade1c07aca54/pone.0321587.g002.jpg
PMC12054909,Fig 3 below highlights the completed steps.,PMC12054909_figure_3,Fig 3. Completed steps and timeline.,,./data/PMC12054909/images/figure_3.jpg,https://cdn.ncbi.nlm.nih.gov/pmc/blobs/5c4e/12054909/493f1335a9e9/pone.0321587.g003.jpg
PMC12054909,"In figure 1 (page 7), there is a step (“Step 6: Conduct a face-to-face meeting with the research team and all experts to finalise the CORMIX tool”) that is not described in the text.",PMC12054909_figure_1,Fig 1. Project steps.,"Moher D, Schulz KF, Simera I, Altman DG. Guidance for developers of health research reporting guidelines. PLoS Med. 2010;7(2):e1000217. PMID: 20169112; PMCID: PMC2821895.",./data/PMC12054909/images/figure_1.jpg,https://cdn.ncbi.nlm.nih.gov/pmc/blobs/5c4e/12054909/5ab99ac8d6f7/pone.0321587.g001.jpg
PMC12054909,"Please check.
• Figure 1: There is a missing word at the end of step 6.
• The authors should avoid using contractions in the manuscript (e.g., there’s (line 81), It’s (line 118), …).
**********
7.",PMC12054909_figure_1,Fig 1. Project steps.,"Moher D, Schulz KF, Simera I, Altman DG. Guidance for developers of health research reporting guidelines. PLoS Med. 2010;7(2):e1000217. PMID: 20169112; PMCID: PMC2821895.",./data/PMC12054909/images/figure_1.jpg,https://cdn.ncbi.nlm.nih.gov/pmc/blobs/5c4e/12054909/5ab99ac8d6f7/pone.0321587.g001.jpg
PMC12054909,"We confirm that several key phases have already been completed. (1) Scoping review (completed September 2024): 50 relevant articles identified from 4,978 screened articles. (2) Questionnaire development and validation (completed October 2024). (3) Expert recruitment (began December 2024, currently ongoing)
To better illustrate this progress, we have added Figure 3 showing completed steps and timeline under a new section “Completed steps"" in the manuscript
- Correct several typos and add some examples, as suggested by the reviewers.",PMC12054909_figure_3,Fig 3. Completed steps and timeline.,,./data/PMC12054909/images/figure_3.jpg,https://cdn.ncbi.nlm.nih.gov/pmc/blobs/5c4e/12054909/493f1335a9e9/pone.0321587.g003.jpg
PMC12054909,• Figure 1: There is a missing word at the end of step 6.,PMC12054909_figure_1,Fig 1. Project steps.,"Moher D, Schulz KF, Simera I, Altman DG. Guidance for developers of health research reporting guidelines. PLoS Med. 2010;7(2):e1000217. PMID: 20169112; PMCID: PMC2821895.",./data/PMC12054909/images/figure_1.jpg,https://cdn.ncbi.nlm.nih.gov/pmc/blobs/5c4e/12054909/5ab99ac8d6f7/pone.0321587.g001.jpg
PMC12054909,"To better illustrate this progress, we have added Figure 3 showing completed steps and timeline under a new section “Completed steps"" in the manuscript.",PMC12054909_figure_3,Fig 3. Completed steps and timeline.,,./data/PMC12054909/images/figure_3.jpg,https://cdn.ncbi.nlm.nih.gov/pmc/blobs/5c4e/12054909/493f1335a9e9/pone.0321587.g003.jpg
