paper_id,claim,figure_id,title,caption,local_image_path,url
PMC11788814,See Figure 1a for the individual study estimates and meta-analytic summary.,PMC11788814_figure_1,Fig. 1.,"Quadratic trajectories of loneliness over time. Point estimates (circles) for each study represent the results from longitudinal models including only data for that study. Error bars indicate 95% confidence intervals (CI) around those effects. Meta-analytic estimates were derived from random-effects meta-analysis. In the right panel, black line displays the meta-analytic average, and colored lines display the trajectories within each study.",./data/PMC11788814/images/figure_1.jpg,https://cdn.ncbi.nlm.nih.gov/pmc/blobs/5930/11788814/112fd1efbfd3/10.1177_09567976241242037-fig1.jpg
PMC11788814,"Results generally indicated a positive effect, revealing a U-shaped curve, in which individuals tended to decrease in loneliness until approximately age 50 and then increased thereafter (see Fig. 1b).",PMC11788814_figure_1,Fig. 1.,"Quadratic trajectories of loneliness over time. Point estimates (circles) for each study represent the results from longitudinal models including only data for that study. Error bars indicate 95% confidence intervals (CI) around those effects. Meta-analytic estimates were derived from random-effects meta-analysis. In the right panel, black line displays the meta-analytic average, and colored lines display the trajectories within each study.",./data/PMC11788814/images/figure_1.jpg,https://cdn.ncbi.nlm.nih.gov/pmc/blobs/5930/11788814/112fd1efbfd3/10.1177_09567976241242037-fig1.jpg
PMC11788814,Meta-analytic estimates were derived from random-effects meta-analysis.Fig. 3.,PMC11788814_figure_3,Fig. 3.,Associations among key baseline predictors and overall levels of loneliness across studies (Part 2). Point estimates (circles) for each study represent the results from longitudinal models including only data for that study. Error bars indicate 95% confidence intervals (CI) around those effects. Meta-analytic estimates were derived from random-effects meta-analysis.,./data/PMC11788814/images/figure_3.jpg,https://cdn.ncbi.nlm.nih.gov/pmc/blobs/5930/11788814/cfa40802532b/10.1177_09567976241242037-fig3.jpg
PMC11788814,Individuals who were under 60 at baseline may increase in loneliness through middle adulthood and then become less lonely at old age (see Figure 6).,PMC11788814_figure_6,Fig. 6.,"Quadratic trajectories of loneliness over time, moderated by baseline age. Black line displays the meta-analytic average.",./data/PMC11788814/images/figure_6.jpg,https://cdn.ncbi.nlm.nih.gov/pmc/blobs/5930/11788814/8b5e89d468ee/10.1177_09567976241242037-fig6.jpg
PMC11788814,"Open in a new tab
Associations among key baseline predictors and nonlinear change in loneliness (Part 1).Fig. 5.",PMC11788814_figure_5,Fig. 5.,Associations among key baseline predictors and nonlinear change in loneliness (Part 2).,./data/PMC11788814/images/figure_5.jpg,https://cdn.ncbi.nlm.nih.gov/pmc/blobs/5930/11788814/dbacd6220492/10.1177_09567976241242037-fig5.jpg
PMC11788814,"Open in a new tab
Associations among key baseline predictors and nonlinear change in loneliness (Part 2).Fig. 6.",PMC11788814_figure_6,Fig. 6.,"Quadratic trajectories of loneliness over time, moderated by baseline age. Black line displays the meta-analytic average.",./data/PMC11788814/images/figure_6.jpg,https://cdn.ncbi.nlm.nih.gov/pmc/blobs/5930/11788814/8b5e89d468ee/10.1177_09567976241242037-fig6.jpg
