paper_id,claim,figure_id,title,caption,local_image_path,url
PMC11261107,This results in expansion and contraction of the chest and or abdominal area (Figure 1).,PMC11261107_figure_1,Figure 1.,Anatomy of respiration mechanism,./data/PMC11261107/images/figure_1.jpg,https://cdn.ncbi.nlm.nih.gov/pmc/blobs/4564/11261107/eda860edd445/gr1.jpg
PMC11261107,"Detecting these abnormal respiratory patterns early can assist healthcare professionals in taking timely action to prevent the patient’s condition from worsening.17
There are several methods to measure the respiration-related events as shown in Figure 2.",PMC11261107_figure_2,Figure 2.,Respiration measurement methods,./data/PMC11261107/images/figure_2.jpg,https://cdn.ncbi.nlm.nih.gov/pmc/blobs/4564/11261107/3cbb2880763f/gr2.jpg
PMC11261107,There are several methods to measure the respiration-related events as shown in Figure 2.,PMC11261107_figure_2,Figure 2.,Respiration measurement methods,./data/PMC11261107/images/figure_2.jpg,https://cdn.ncbi.nlm.nih.gov/pmc/blobs/4564/11261107/3cbb2880763f/gr2.jpg
PMC11261107,"Characterization of the pressure sensors
Figure 3 shows the raw and filtered signals collected from the middle top sensor on the belt which was the best performed on both belt and OptiTrack.",PMC11261107_figure_3,Figure 3.,"Raw data, filtered data, breathing rate, and breathing amplitude of the data collected from the belt",./data/PMC11261107/images/figure_3.jpg,https://cdn.ncbi.nlm.nih.gov/pmc/blobs/4564/11261107/61443d9bd236/gr3.jpg
PMC11261107,Figure 4 shows a typical example of the data collected from the belt during the standing section of the experiment.,PMC11261107_figure_4,Figure 4.,"Raw data, filtered data, breathing rate, and breathing amplitude of the data collected from the belt during standing",./data/PMC11261107/images/figure_4.jpg,https://cdn.ncbi.nlm.nih.gov/pmc/blobs/4564/11261107/e863812abc08/gr4.jpg
PMC11261107,Figure 5 shows the filtered data collected from both chest belt and OptiTrack IR cameras.,PMC11261107_figure_5,Figure 5.,Filtered data collected from belt and camera,./data/PMC11261107/images/figure_5.jpg,https://cdn.ncbi.nlm.nih.gov/pmc/blobs/4564/11261107/59cee50cf3cd/gr5.jpg
PMC11261107,Figure 6 shows the correlation between the breathing rates with respect to the phase lag between the pressure sensors and the camera recorded signals.,PMC11261107_figure_6,Figure 6.,Cross-correlation between respiration date computed using the belt and camera data,./data/PMC11261107/images/figure_6.jpg,https://cdn.ncbi.nlm.nih.gov/pmc/blobs/4564/11261107/2c67d8a2414d/gr6.jpg
PMC11261107,Figure 3 shows the raw and filtered signals collected from the middle top sensor on the belt which was the best performed on both belt and OptiTrack.,PMC11261107_figure_3,Figure 3.,"Raw data, filtered data, breathing rate, and breathing amplitude of the data collected from the belt",./data/PMC11261107/images/figure_3.jpg,https://cdn.ncbi.nlm.nih.gov/pmc/blobs/4564/11261107/61443d9bd236/gr3.jpg
