paper_id,claim,figure_id,title,caption,local_image_path,url
PMC7010101,"The first one (Figure 1), represents how in general, EFSA Units incorporate the QPS status of a certain TU, related to a microorganism notified in an application, into their own evaluation process (risk assessment).",PMC7010101_figure_1,Figure 1.,"Workflow diagram describing how EFSA Units incorporate the QPS status into the safety assessment process of a microorganism notified through an application for market authorisation – overall process


QPS: Qualified Presumption of Safety.",./data/PMC7010101/images/figure_1.jpg,https://cdn.ncbi.nlm.nih.gov/pmc/blobs/785c/7010101/db4b7dd6adf0/EFS2-15-e04664-g001.jpg
PMC7010101,EFSA screens the respective TUs and chooses which ones are to be included in the ongoing Panel Statement to be considered for the QPS list (Figure 2).,PMC7010101_figure_2,Figure 2.,"Workflow diagram describing how QPS status is assessed for the TU related to the microorganism notified to the EFSA Units under the frame of applications for market authorisation – elaboration of the BIOHAZ QPS Panel Statements


BIOHAZ: Biological Hazards Panel; QPS: Qualified Presumption of Safety.",./data/PMC7010101/images/figure_2.jpg,https://cdn.ncbi.nlm.nih.gov/pmc/blobs/785c/7010101/e3a28f829ce3/EFS2-15-e04664-g002.jpg
PMC7010101,"For TUs initially not included in the QPS list, but for which a new recommendation for that list is provided from the process described in Figure 2, the inclusion in the list may still be considered for the risk assessment process of that specific EFSA Unit.",PMC7010101_figure_2,Figure 2.,"Workflow diagram describing how QPS status is assessed for the TU related to the microorganism notified to the EFSA Units under the frame of applications for market authorisation – elaboration of the BIOHAZ QPS Panel Statements


BIOHAZ: Biological Hazards Panel; QPS: Qualified Presumption of Safety.",./data/PMC7010101/images/figure_2.jpg,https://cdn.ncbi.nlm.nih.gov/pmc/blobs/785c/7010101/e3a28f829ce3/EFS2-15-e04664-g002.jpg
PMC7010101,"The second flow chart (Figure 2) represents how the evaluation of newly notified TUs, not found in the QPS list, is included in each BIOHAZ Panel Statement.",PMC7010101_figure_2,Figure 2.,"Workflow diagram describing how QPS status is assessed for the TU related to the microorganism notified to the EFSA Units under the frame of applications for market authorisation – elaboration of the BIOHAZ QPS Panel Statements


BIOHAZ: Biological Hazards Panel; QPS: Qualified Presumption of Safety.",./data/PMC7010101/images/figure_2.jpg,https://cdn.ncbi.nlm.nih.gov/pmc/blobs/785c/7010101/e3a28f829ce3/EFS2-15-e04664-g002.jpg
PMC7010101,"EFSA screens the new TU included by the EFSA Units in the ‘notification list’ (Figure 1), checks the respective TU and chooses which are to be included in the ongoing Panel Statement to be considered for the QPS list.",PMC7010101_figure_1,Figure 1.,"Workflow diagram describing how EFSA Units incorporate the QPS status into the safety assessment process of a microorganism notified through an application for market authorisation – overall process


QPS: Qualified Presumption of Safety.",./data/PMC7010101/images/figure_1.jpg,https://cdn.ncbi.nlm.nih.gov/pmc/blobs/785c/7010101/db4b7dd6adf0/EFS2-15-e04664-g001.jpg
PMC7010101,"If the TU is already in the QPS list, it is not evaluated at this stage but considered for the process represented in Figure 3.",PMC7010101_figure_3,Figure 3.,"Workflow diagram describing how QPS status is reassessed for the TU included in the latest QPS list – elaboration of the BIOHAZ QPS Opinion


BIOHAZ: Biological Hazards Panel; QPS: Qualified Presumption of Safety.",./data/PMC7010101/images/figure_3.jpg,https://cdn.ncbi.nlm.nih.gov/pmc/blobs/785c/7010101/bb0f20cc3860/EFS2-15-e04664-g003.jpg
PMC7010101,The third flow chart (Figure 3) represents how the evaluation of the TUs included in QPS list (reference to 2013 update Opinion) is performed.,PMC7010101_figure_3,Figure 3.,"Workflow diagram describing how QPS status is reassessed for the TU included in the latest QPS list – elaboration of the BIOHAZ QPS Opinion


BIOHAZ: Biological Hazards Panel; QPS: Qualified Presumption of Safety.",./data/PMC7010101/images/figure_3.jpg,https://cdn.ncbi.nlm.nih.gov/pmc/blobs/785c/7010101/bb0f20cc3860/EFS2-15-e04664-g003.jpg
