paper_id,claim,figure_id,title,caption,local_image_path,url
PMC4834624,"The number of non-citable articles was 2, 3, 2, 3, and 1, respectively (Fig. 1).",PMC4834624_figure_1,"Fig. 2. Number of funded and not-funded articles from the Journal of Gastric Cancer, according to year.",,./data/PMC4834624/images/figure_1.jpg,https://cdn.ncbi.nlm.nih.gov/pmc/blobs/c534/4834624/8b255394450a/jgc-16-8-g002.jpg
PMC4834624,The proportion of original articles funded was 39 out of 113 articles (34.5%) (Fig. 2).,PMC4834624_figure_2,Fig. 3. National origins of authors of 209 articles from the Journal of Gastric Cancer-from 2011 to 2015.,,./data/PMC4834624/images/figure_2.jpg,https://cdn.ncbi.nlm.nih.gov/pmc/blobs/c534/4834624/6bc96564312d/jgc-16-8-g003.jpg
PMC4834624,"Out of them, 183 articles were from Korea, 11 were from Japan, and 7 were from USA (Fig. 3).",PMC4834624_figure_3,Fig. 4. Total citations of the Journal of Gastric Cancer from 2011 to 2015-from the Web of Science Core Collection [cited 2016 Jan 30].,,./data/PMC4834624/images/figure_3.jpg,https://cdn.ncbi.nlm.nih.gov/pmc/blobs/c534/4834624/e820755c8431/jgc-16-8-g004.jpg
PMC4834624,The total citations increased from 1 in 2011 to 245 in 2015 (Fig. 4).,PMC4834624_figure_4,Fig. 5. National origins of authors of who cited the Journal of Gastric Cancer from 2011 to 2015-from the Web of Science Core Collection [cited 2016 Jan 30].,,./data/PMC4834624/images/figure_4.jpg,https://cdn.ncbi.nlm.nih.gov/pmc/blobs/c534/4834624/0f6d3df456f1/jgc-16-8-g005.jpg
PMC4834624,"The top-ranking countries of citing authors were China (171), Korea (158), and Japan (75) (Fig. 5).",PMC4834624_figure_5,Fig. 6. Nine source titles most frequently citing the Journal of Gastric Cancer from 2011 to 2015 (at least 10 times)-from the Web of Science Core Collection [cited 2016 Jan 30].,,./data/PMC4834624/images/figure_5.jpg,https://cdn.ncbi.nlm.nih.gov/pmc/blobs/c534/4834624/d9f3bb2a8857/jgc-16-8-g006.jpg
